"","body","season"
"86","Their problem was that season 7 was just stalling as they didn't want to lose their most popular villain. Had they dispatched with Cersei at the end of that season and used the whole of season 8 for the white walkers, it would have been a whole lot better. Basically, imagine episode 5 of season 8 as the last of season 7. Kings Landing burning while the wall falls. Season 8 then starts with a Winterfell under siegs by the dead and John wanting to save his sister.

I really don't know why they switched the final boss around. Would it have been anticlimactic with just the white walkers? Maybe, but season 8 always was more of a last hurrah than a deep new conflict/epic emotional culmination. Well, it's too late now... :)","season 8"
"87","Depends on who you are. I love season 8.","season 8"
"88","Hopefully its not a disappointment in season 8","season 8"
"89","While I don’t dislike it, it is by far my least favourite of the bunch because it largely abandons the more complicated spirit of its cast. Season 8 recovers that and the two are really a two-part final season so it still works for me, but it mostly just feels like a season of setups","season 8"
"90","They spent longer on season 8 than they did any other season, and they only ever intended to do 7 seasons until they realized that logistically it had to be 8. They *did* pace the season much faster, but that does nothing to alleviate the workload for everybody involved","season 8"
"91","&gt;\&gt; Rest, dany going mad, cersie-jamie, theon, jon, sansa, arya, tyrion ending, etc. all seems to make sense.

A thousand times this.

The biggest/loudest complaint about the final season seems to be something about *""character assassination/Character X ruined""*, but the groundwork for every arc (aside from Bran's) has been laid across the previous 70+ episodes. Dany's descent and capacity/willingness to raze entire cities because of that Fire and Blood persona. Jaime not giving two fucks about the common folk. Jon absolutely not wanting power or to deal with Westerosi politics. It's all clearly portrayed on-screen for the 80 hours leading up to the finale.

Sure, the quality of Season 8 was clearly sub-par, no argument there, as the writing definitely took a dip, but a huge majority of the character arcs certainly make sense when viewed through an unbiased lens, especially upon a rewatch.

Wish everyone were able to follow in your footsteps and revisit the story with fresh eyes, as I think a lot of issues were overlooked due to personal biases or simply missing details the first time through, so props to you for taking the plunge... hope you feel 'rewarded' for your efforts.

PS - *'lowkey satisfied'* is the perfect way to describe how it all wrapped up... nailed it!","season 8"
"92","I started rewatching GOT in preparation of house of the dragon but twice I’ve stopped at season 8. Martin is such a good story teller and HBO producers can’t simply match.","season 8"
"93","I consider this the end of the series. It saves me from all the pain I feel when i think of season 8.","season 8"
"94","God's the final two episodes of season 6 were amazing, the hype was off the chart, why could they have not got the ending right, makes me sad I would have rewatched that show over and over for the rest of my life it really was top tier TV until season 8","season 8"
"95","Scenes like this still give me chills….but damn does that sour taste of season 8 linger to the point of not being able to start a rewatch yet.","season 8"
"96","That is a very good point.  I guess I always thought she was going to overthrow the government but “fire and blood” has probably never benefited the average pleb.  I’m going through the books now for the first time (I’m on a storm go swords) and I am looking for all the hints of Dany-was-always-going-to-mad.  And I think you’re also right re:Targaryen…Aeres (spelling?? The mad king) from what a gather was a pretty normal lad and hung out with Tywin and (maybe) Stephon Baratheon and then went nutso with age and power.  Makes sense Dany would do the same.  

 I still hate season 8 though. (Except the costumes).","season 8"
"97","I think it's an issue of spectacle over substance.

For example, I thought the ""Field of Fire"" where Daenerys torched the Lannister soldiers was visually impressive, but character motivations, their decisions and the weight of their actions started to feel nonsensical.

I remember that I liked the first few episodes well enough, but the more I think of it, the more frustrated I got. That was even before Season 8.","season 8"
"98","What was wrong with Game of Thrones? People made the mistake of trying to look at it as “a work of art” when it was really just a money-making venture. Everybody involved in it got tired of it before the audience did and wanted to move on. If the people who make it get sick of it, how is the audience supposed to care? After getting paid a fabulous sum in advance for it, George R.R. Martin got tired of writing it and simply stopped writing it. Even today, he keeps saying he’s going to finish it, but no one believes him any more.

After he stopped writing, Benioff and Weiss were forced to write original material, something they really sucked at. Season 8 showed they have no talent in this area at all. When George opted out, the two faux writers decided to take GOT out behind the barn and shoot it. They did this in such a hurried and shoddy way that even the normally unperceptive and not swift audience took notice, and their was endless moaning and complaining about it. It was a huge debacle. George R.R. Martin cared Nothing for the outcry, Benioff and Weiss even less, and HBO least of all, because all of these entities made huge pots of money, the only reason that this whole cash cow was made. HBO was pleased to win the Emmy, not so pleased that half their viewership evaporated after GOT was gone.

Now it’s in the past, although the disappointment of the former fans still lingers. Audience, as long as you continue to put up with shoddy work, you are going to continue to get shoddy work for like Forever. Perhaps scrutinize the “next big epic” very closely before getting too involved. Amazon’s new LOTR movie, for instance. And of course, The Three Body Problem.","season 8"
"99","I am in season 8 and I am enjoying it throughly and struggling to see what problems people had with it","season 8"
"100","Tbh i liked season 7, the story is good only and has good scenes. people hate it because it's too fast paced, has bad writing and isn't too logical which i did agree after watching few yt vids. But still some episodes are good, some bad . But one thing i liked is that a lot of characters get to meet each other. Also i didn't start season 8, will start today and hearing overall it's bad but some people say the first 3 episodes are ok","season 8"
"101","She wanted to break the wheel. Her description of the wheel is spokes that go round and round vying for power. To take out the spokes means her on top with zero dissent. Her views around dissent and how she deals with it make up the bulk of her story in Maareen; those that did not love her dethroned her. It was only with Fire and Blood, stamping them out, burning the slavers ships (which is of note in itself; previously she had waged war in a way as to not flambe slaves, it is only after she follows through with her threats that Maareen is truely 'won') to force a peace.

When she arrived in Westeros she had a strong claim, 3 dragons (who were difficult to kill) , a complete army of unsullied slaves and the horde army in the Dothraki. She was in a comfortable position, she had that much firepower its easy to be content and wait. There wasn't anyone who couldn't actually threaten her.

By the end she was in a much weaker position had a single dragon, half her army, her claim was being questioned by those who wanted Jon on the throne, along with the fact her closest 'friends' (and I'd argue she never had any friends, Missandei and Grey worm were in their minds repaying a debt and planning their life after Daenerys) were gone, and Westeros has weapon advancements that threatened the last remaining dragon.

Visares introduces the Machiavellian concept of 'Who can rule without fear or love?' in season 1. Danys entire story explores this, the point in Essos isn't to show us Dany like freeing slaves so much (there's really no need for 5 seasons of that...)  , more her situation, she is ruling over two peoples one with extreme version of love and one with a more extreme dislike, how she handles and ultimately resolves this feed into the finale.

During S8 she becomes disillusioned with Westerosi people. She does not believe she will be accepted, or loved. Her weak position makes her act more rash - going for Kings landing so soon after the battle at Winterfell is a form of desperation because she feels her power slipping away. In Essos she had a hard enough time controlled a percent of the population who rebelled.

By the time she leaves Winterfell she is erratic, acting irrationally, paranoid and delusional because of her state and slipping power. Losing another dragon only makes this worse. She can not rule without fear or love and she decides fear it is.

Burning it all is a more effective fear than just removing one person in power. Like the masters she needs to teach them she is willing to go Fire and Blood. The masters surrenders once and what good did that do her? She knows taking and sitting on a throne isn't a guarantee of power, she's been there. Power resides where men believe it resides.

Otherwise, Daenerys other characterisations allowed her to do this. While she has an affinity for freeing the enslaved, she also believes herself to be a sort of divine being, a fair number of her speeches before Season 8 go a bit *manifest destiny,* much of her final speech to her followers are all things we'd heard before but didn't have the same context.  Her long list of titles and general narcissism is best displayed in the scene where she meets Jon snow and talks about how faith in herself kept her going because she is special *'This is Jon snow... hes King in the North'* works as comic relief because the former was so self important and grandiose.

In S6 she's speaking with Hizdahr at the fighting pits and it's a really good dialogue into how far she is willing to go and *why;*

Daenerys - one day your great city will return to the dirt as well

Hizdahr - At your command?

Daenerys -- If needs be.

Hizdahr - And how many will die to make that happen?

Daenerys - if it comes to that, they will have died for a good reason.

Hizdahr - those men think they are dying for a good reason

Daenerys - - Someone elses reason

Daenerys didn't really change. Her situation did and she decided that now needs be, justified to herself by those that are dying are dying for a good reason (her reason), which she has long believed but previously not required (in her mind) .. Ultimately her want for unrivalled conquest was more important to her than the lives of those people, that is the conflict in Dany. The tragedy is it wouldn't have happened without the WW and Jon saga, the scary thing is she was always capable of deciding needs must.","season 8"
"102","They knew how they wanted to end it, but had no clue how they were going to get there. They’ve admitted this in interviews and allude to it in the post episode interviews. I don’t think it’s wrong to have fun reading theories. And the reason I am disappointed in the end of the series (seasons 7 &amp; 8) has nothing to do with my “internal fan fiction.” The series is incredibly complex and I assumed my ideas not even coming close to what they’d create because my imagination never reached that of GRRMS. The disappointment in a rushed ending with terrible dialogue and complete lack of character development is valid. You can disagree with me, that’s why it’s an opinion not fact. You even acknowledge they discussed the main characters but by season 8, all of the side characters became main ones and they didn’t have stories anymore. Brienne, Cersei, onion knight, Missandei, grey worm, Varys, the red woman, and so many others. So many stories that had development over the years just went nowhere imo. And watching interviews where d&amp;d comment that they didn’t really have a solid plan throughout is tough to hear.","season 8"
"103","&gt; They wouldn’t show up to a con because they didn’t want to answer fan questions after season 8. They’ve literally admitted to not knowing where to take the story and there was never a plan for how to end while the seasons were going, which is insane in my opinion.

GRRM said he gave D&amp;D his planned endings for all the major characters when D&amp;D spent two months with him in New Mexico getting their scripts to line up with his plans for the books.  HBO did want more GoT, but after D&amp;D explained their plans for the end of the series, HBO signed off on it happening that way.

You don't have to like their plans, but to deny that they even existed is a bit odd.

One of the worst things anyone could do in GoT was subscribe to fan theories.  IMO much of the dislike for the ending of the series came from viewers who expected to see their internal fan fiction on the screen and were angered when that didn't happen.  That the disgruntled faction is still indulging in this nonsense over three years after the end of the show is astonishing.","season 8"
"104","First off, might want to dispel the notion that her entire identity was about freeing slaves and realize that literally most of her screentime was spent pursuing power for herself. 

Seasons 1, 2, and the beginning of 3? All about conquering the Iron Throne for herself. Seasons 7 and 8? All about conquering the Iron Throne for herself. So 4.5 seasons of conquering versus less than 3 about freeing slaves (back half of Season 3, Season 4, Season 5, one episode in Season 6.. the clear minority.)

Her time in Slaver's Bay was a single arc, not some 'whole' identity. 

That said, I think a fresh and unbiased rewatch always helps paint a clearer picture of the issue. 

Season 8 completely implodes her world around her. If you see her psyche as a Jenga tower, it's easy to see how it becomes increasingly unstable throughout the final season until it is this unstable, teetering structure that finally topples over in an emotional moment. 

Her support structure crumbles (deaths, betrayals), her hopes and dreams and beliefs shattered (Jon's heritage reveal, she's not the Chosen One, Westeros doesn't love her) and her promising relationships all sour (killed, betrayed, Jon's romantic relationship ends.)

Keep in mind she's a young adult with a fucked-up upbringing (sold, raped, etc) with a Fire and Blood persona and family history of mental issues. Her entire world comes crashing down on her in a short amount of time, and this is a person who, has literally stated from her own mouth multiple times previously that she is capable/willing to raze entire cities if she feels the ends justify the means. 

She clearly states, in the latter episodes an increasingly deteriorated mental state, that she now sees the people of King's Landing as 'supporting' Cersei (ie, enemies) and that she has decided to ""Rule by Fear.""

Then, once she sees the Red Keep, that Jenga tower that's been teetering on a single piece because of all the other pieces that once held it in place are missing, finally topples over, and that Fire and Blood persona that's been bubbling up all this time is finally unleashed in full force. 

Wish we could have gleaned more context from the scene if we could have seen her as she razed part of King's Landing, but unfortunately we didn't get to see her again until the aftermath in the next episode.","season 8"
"105","The two people are the creators d&amp;d. There is a big theory that after season 8 was panned and fans were disappointed in how they finished the series they were completely over game of thrones. HBO wanted them to have more seasons but they were over it and ready to move on to a Star Wars project (which eventually fell through). They wouldn’t show up to a con because they didn’t want to answer fan questions after season 8. They’ve literally admitted to not knowing where to take the story and there was never a plan for how to end while the seasons were going, which is insane in my opinion. They cameoed in westworld killing Drogon showing they don’t give a shit about thrones fandom, etc. — I’m not saying any of this is fact obviously. It’s just a theory that I find pretty solid based on their responses to fans over the years since the series ended.","season 8"
"106","Dumb and dumber. Unfortunately he did not eat them before they made season 8","season 8"
"107","Guy I worked out with got me into the show at the start of season 8 and he hated it as much as I did.","season 8"
"108","*BuT GaMe oF tHroneS disAppeaRed fRom pOpUlar CULture AfTer D&amp;D RuinEd SeaSON 8!*","season 8"
"109","Don’t watch season 8. End with season finale of 7, then imagine your own ending. Anything you come up with will be better than the real ending","season 8"
"110","Bruh what? I love GOT, but season 8 is definitely as bad as they say.","season 8"
"111","don't watch it, run as far as you can from this piece of garbage that is season 8","season 8"
"112","As tragic as so many Targs are, especially the ladies, I suspect there won't be that many.  Moreover, there were also a lot of little ""Khaleesis"" and ""Daeneryses"" running around until after Season 8.  I've seen jokes in SM about the people who probably want to change daughters' names.  So I don't expect that trend to continue.","season 8"
"113","&gt; And not only forward in time, but also going backwards.

And not only forward, but backwards; not backwards, but also upward. And as always: twirling, twirling, twirling towards Season 8!","season 8"
"114","You know when you're about to sneeze and it stalls and you're left wondering if you're gonna sneeze or not...that's the feeling season 8 leaves you with.","season 8"
"115","I thought the show was going downhill long before the rushed season 8. Nonsensical plotlines started around Arya's arrival at the House of Black and White.","season 8"
"116","True, they did and that’s sad. But come to think of it, I’d rather they took a portion of the story and did it well that give us the sped up hack job that was season 8.","season 8"
"117","Even on set it felt rushed and not cared for. Unlike other seasons. It took the directors a whole day just to get the Hodor scene right. But season 8 just got yeeted out asap","season 8"
"118","Yes! When the scene happened I thought it was a really cool prequel moment to *the books*, not to Season 8. So it actually helps the anticipation for the book endings.

Back when GoT was at its best people were always debating and discussing cool new lore reveals and this utterly new reveal that Aegon actually conquered Westeros because he foresaw The Long Night is *awesome* and only adds to the world building and history!","season 8"
"119","Whoever is downvoting explain. Did anyone actually like season 8?","season 8"
"120","I came into the show having read the books first, so it was easier to follow. If I hadn't read the books I would never have watched the show. But the downside to this is that only 5 books have been published so far. I don’t think books 7 and 8 will ever see the light of day.

If you're itching to get started on HoTD, you shouldn't let not having seen the other one stop you. You could also read Fire and Blood (put it on hold at your library, but at mine the wait list is long) and then decide from there.

If you choose to watch GoT here's something to keep in mind:

Season 8 broke my heart, but not in the way a sad story will. It will make you distance yourself from your favourite characters because the showrunners were in a hurry to finish things up. If you can keep this in mind and not get too attached, it's a beautiful story.

I haven't the heart to watch HoTD just yet. I'm probably going to wait until a few seasons are over.","season 8"
"121","Holy shit I’m jealous how the hell did you like season 8 lol.","season 8"
"122","As bad as Season 8 was in general I think I would be able to somehow accept it and live with it. However, I wish I turned TV off in the middle of last episode. The very ending is so bad that no meme can justify that shit.","season 8"
"123","Save yourself the trouble and don't even bother with season 8. It actually makes the rest of the show worse by viewing it and ruins the ability to re-watch the series.","season 8"
"124","Yes. I highly recommend watching it. That’s a great show indeed. Five seasons are based on books so the plot there is on point. Season 6 is great and 7 is good too imo but after that things start to go downhill.

Even if you decide not to watch season 8, there’s still plenty of episodes to enjoy.","season 8"
"125","Then you look at season 8 and admire it right? Right????","season 8"
"126","Yes season 8 was that bad. JFC

There wasn't a single episode in that season that was even mediocre. 

Season 6 and 7 at least had some okay to good moments, but Season 8 was absolutely that bad.","season 8"
"127","But that was all Season 8 right?","season 8"
"128","Season 8 really left us with trauma","season 8"
"129","I disagree that it's an online thing. Have you heard anyone recommend game of thrones since it season 8 aired? I haven't. I have heard friends and family who are barely online tell people not to bother. I have had coworkers who can barely use a computer express anger and frustration over the season 8.

Their metrics may indicate it is okay, but it turned the show from a masterpiece into a joke. 

I need to stop typing now because I am getting angry over it, and the fact anyone would defend it.","season 8"
"130","I completely forgot how the season 8 intro looked.","season 8"
"131","I cannot stress enough that it was wonderful to see King's Landing once again, and not the crap-prop version that was used for season 8.","season 8"
"132","I'm impressed, i think going with all new characters and a time period way before GoT is what it needed to reset after the disappointment that was season 8 of GoT.","season 8"
"133","It's exactly the pilot this show needed.

The dialog is worlds better than late GoT but not quite up to the level of early GoT, but that is to be expected because they can't just lift from the books. The characters and the actors also seem good. I liked the focus on plot development rather than spectacle. Music is always good but I do hope we get more unique tracks moving forward rather than just rehashing the old score. I loved the costume and set design and am glad that we have more diversity in looks because at a certain point it felt like GoT just wanted a character to wear just one set of clothes.

I'm apprehensive about the decision to make the Long Night prophecy important to the story. On one hand, it makes sense that there were multiple Targaryens who believed that was their destiny (Rhaegar for example) and it is a very important part of ASOIAF. On the other hand that shit was so trash when it actually happened that forgetting that it was a thing might be for the better.

Most importantly I liked the sense of familiarity it gave back to me. I remember watching Season 8 of GoT and feeling that it wasn't even the same show anymore. But HotD felt very familiar with what I associate with GoT. Ten minutes in and I felt nostalgic. And I think that is something that was imperative to winning back fans who fell out of love with the series. Remind us why we fell in love with GoT in the first place.","season 8"
"134","I’m not even a fan of GoT and the top comments basically amounting to “season 8 wasn’t *that* big of a disaster, go and watch Thrones on HBO! It’s worth it!”","season 8"
"135","I don't feel the same way, but I understand why you'd feel that way.

The main reason why I don't feel that way is that, tbh, in my opinion the show started going downhill in season 5 and kept slowly going downhill for season 6, 7 and 8. So by the time season 8 rolled around I was already pretty emotionally disconnected from it all and wasn't expecting anything good.

I prefer to see seasons 1-4 as the REAL show and the canon show and think of 5-8 as some fan fiction that never happened. That allows me to enjoy seasons 1-4 for what they are, I think. Because I consider that the full TV story.","season 8"
