"","body","season"
"51","I love this show. My second favorite show ever. But I can go on and on abojt season 8, but this episode in particular. So many weird and just dumb choices. Absolutely hated that episode, outside some of the cool cinematography sequences. As dumb as the Dothraki charge was, it made for a cool scene with the flames going out. Really set the tone. I wish they just made it make more sense. No respectable war tactician would send the Calvary first like they did. So, just meh.","season 8"
"52","Oh for sure! This is my favorite show ever outside Band of Brothers. I could talk about this show forever. 

Saying that, I hate almost everything about season 8. Why didn’t they bring back Meera? Wtf was up with that. Such weird choices they made.","season 8"
"53","I made no comparisons between game of thrones to transformers.  I was giving you an example of a technically amazing movie with shit writing, to make the point that a show isn't about it's technical achievements.  You can make a cake that looks amazing, but if it doesn't taste good then it's not a good cake.  GOT season 8 looks amazing, and no one is arguing that it doesn't.    Your reading comprehension is incredibly low and I'm guessing this is why the terrible stupid writing of season 8 doesn't bother you.  So things people of normal intelligence would say  ""hey, that makes no sense and it's really dumb""  You be too distracted saying  ""OMG DRAGON IN THE CLOWDS SO COOOL"".","season 8"
"54","Not downvoting, but my sense is a few people tolerate it / came to like it ok, while most people thought it was terrible.  Honestly I've never seen anything resembling the degree of consensus there's been on GOT season 8 on any show (no matter how bad) so I think simply calling it 'divisive' is a bit misleading...

Can you find things to like in it? sure... but the character writing was just so bad.  You can come round to it, but you basically have to think about it as a different show or else massively lower your standards - which is my basic understanding of why it might become tolerable on a rewatch, even though it was intolerable to basically everyone who watched it on release.  ((Like there was... basically a global consensus that it was s\*\*\* compared to what came before.  Never seen anything like that before or sense xD ))

Edit: d\_unit4595 summed this up super well actually.  It's ""like going into a Marvel film and expecting Breaking Bad or The Wire level of writing"".  But the thing was, its audience as a whole /was/ expecting good writing, and not a marvel movie finish to a series that we not only loved, but was at times intensely painful to watch precisely because of how non-Marvel it was.","season 8"
"55","Lol this has been my favorite joke about GoT for years.  (Like ""remember how everyone died in episode 3 and the rest of season 8 was just the white walkers setting up their new society?? xD)

It's a much more satisfying head cannon, glad to know I'm not the only one who resorted to that.","season 8"
"56","I feel you. I shifted my expectations after the show surpassed the book content. Around season 6 (which is a season I still love) I noticed it slowly start inching into the standard Hollywood action movie level of writing the more that D&amp;D, your typical Hollywood writers, got more creative control. More shortcuts in the story were being taken, plot conveniences started occurring more, survival capabilities started turning more into comic book movie level. For me, it was never to the extent that it ruined the seasons and the positives of those seasons always outweighed the negatives. And I personally feel the same with season 8. Even though the tonal shift was a bit jarring due to what the show was for the first 4 or 5 seasons. Even then, especially since the issues I listen above really took a toll on S7, going into season 8 stressing over every detail wasn’t necessary. That’s like going into a Marvel film and expecting Breaking Bad or The Wire level of writing. Not saying it’s right, and I’m not saying the season shouldn’t have been fleshed out way better, but just because it could’ve been way better doesn’t mean we still got a dumpster fire of a season like some seem to act like. And I think more people are noticing this as they rewatch the series.

For me, it’s more of a case of I’m not going to let a few unideal things ruin the show I spent years of my life enjoying, especially when in my eyes, there was a lot in those seasons I could enjoy. And it was more than just the spectacle. I liked where all the character arcs ended up even if getting there was a tad clumsy.","season 8"
"57","&amp;#x200B;

&gt;Finally shes willing to take a public stand for something (Northern Independence)that many of the people around her want.

I'm going to guess this wasn't an intentional choice by D&amp;D, but The Northmen didn't earnestly want independence. They were, at best, opportunist. The northern lords would have helped Jon and Sansa get rid of Ramsey if they actually wanted independence. The Starks had 405 northmen on their side while Ramsey had 5k+. 

&gt;Those things give her power.

One of the sillier retcons between seasons 7 and 8 is Sansa's shifting opinion of the northern lords. Here's what she said to Littlefinger when he was trying to get her to betray Jon:

&gt;*SANSA: Yes, they turned their backs on Jon when it was time to retake Winterfell and then they named him their king and now they're ready to turn their backs on him again. How far would you trust men like that? They're all bloody wind vanes*.

Cut to season 8 and she trusts the ""wind vanes"" to help her rebel against someone with a huge army and two dragons? That doens't make any sense.","season 8"
"58","Honestly just watch until Season 8 Episode 3 and then I dip","season 8"
"59","I think too myself I’ll rewatch it at some point, then the thought of hitting season 8 completely stops anymore thoughts of rewatching. It’s like The Office when Steve Carell left. It’s just not the same anymore, and knowing the end puts it off for me completely.","season 8"
"60","&gt; because of the controversy over the last season I’d be surprised if it held much value

There are several similar items on eBay right now priced around five thousand bucks.  Some of these people are huge stars at the moment, and that's what autograph collectors are after, they won't waste time worrying about how Season 8 of GoT ruined some fans' lives.","season 8"
"61","I rewatch it once a year. I didn’t hate season 8 like the sub keeps telling me to.","season 8"
"62","I think it says a lot when the only watchable episode in season 8 is the most understated one, ep 2.

That got my hopes up that they might tie it up relatively well, only for the battle to absolutely crush any hope I had left","season 8"
"63","i’ve been watching this series on youtube it’s basically a season 9 of games of thrones podcast, it takes place after the last episode of season 8 i recommend it  made me not as sad lol https://youtu.be/oupHONsXsZc","season 8"
"64","Same thing happens with me, I just really try to avoid the ending and enjoy everything about the first 6 seasons without connecting anything to season 8 just waiting for the real ending that is never going to happen.","season 8"
"65","Faceless men techniques still include stealth movement and it was area which Arya knew really well.

And GoT sure had problems but some stuff that is bashed in bad season 8 is praised in other shows as badass. And when in season 4 Jon was losing to Karl fans cried that hero shouldnt be losing. 
Batman is just good example, everything he does is praised badass even though most of it is basic plot twists.","season 8"
"66","After season 8? Not much…","season 8"
"67","Don’t sell it, because of the controversy over the last season I’d be surprised if it held much value. The only logical time there was to sell it was right before season 8 it would have gone for a lot but also I agree with other comments that authentication is very sus and if you try to sell it most buyers are going to want a more official authentication which would probably really cut into profit margins. Cost &gt; Profit not worth it…","season 8"
"68","You want figures from Before or After Season 8?","season 8"
"69","Before or after season 8?","season 8"
"70","Even if season 8 is bad that doesn’t make s7 bad","season 8"
"71","The thing is, were they just blindly copy pasting? Did they not even know the historically accurate reason George used the term ""Loose""? And when they wrote Season 8, they just sort of forgot and used ""fire instead""?

And GoT did NOT have bad writers. Certain scenes, such as between Aryia and Tywin, or the Tarantino-like scene between the Hound and the Soldiers at the Inn, were completely written by the Series.

So either they had staff writers that were uncredited that were actually good writers.

Or for Season 8, they wanted to get it over with as fast as possible (to do Star Wars), spent no time looking over their draft.

In the end, they fucked up Season 8 so badly that they probably got fired from their Star Wars gig.","season 8"
"72","I just rewatched season 6, and before that I was completely ok with arya killing the night king but after this rewatch im like how tf isn't is jon that kills him. the show went completely left in season 8.","season 8"
"73","There are so many holes and wasted opportunities in season 8. Best to forget it ever happened.","season 8"
"74","\*Cries as I accidentally deleted my response.\* Ok, one more time.  


&gt;Lol, just because a line is spoken doesn't magically make it some ironclad truth... wild that 8 seasons of Game of Thrones hasn't taught you that.  
&gt;  
&gt;I mean, you seemingly claim a character's word is ironclad and cherry-pick some quote as if it's gospel, but when I point out that she, multiple times STATED ON-SCREEN she going to kill thousands upon thousands of innocents because she wanted to, that doesn't count in your eyes? Only the quotes you cherry pick matter or count as canon or can be construed as fact? Any quotes that disprove your quotes magically don't count because Dany reasons?  
&gt;  
&gt;Talk about bad faith discussion.  


I got plenty of more, ""I am not my father."" ""I am not here to be queen of the Ashes."" ""Then we have 200,000 reasons to take the city."" ""I don't want another child's bones dropped at my feet."" ""I am a queen, not a butcher.""   


And how am I cherry-picking? My point wasn't ""This is everything Danny has ever said this proves my point and your quote was fabricated."" That would be ridiculous.  


You brought up the scene where she threatens to burn all the wise masters cities while watching them attack her city and trying to burn it down. My point is that my quotes are just as viable as yours, and arguably more so since she actually acted on these, she did free the slaves, she chained up her dragons, and she only made the city-destroying threats for betrayal such as when the master broke a promise and attacked, or when Yunki and Astapor were retaken by them. The people of Kingslanding have not done anything of the sort and even still despite the masters being the worse and honestly even I would have defended her if she whipped them out she didn't likely not just for moral reasons but practicality as well as listening to Tyrion got her the ships she needed to sail to Westeros and abandon Mereen, which is an issue itself but I am trying to focus on season 8 and the shit stain that it is. 

&gt;I mean, if in one scene a character says they would never kill someone, then in multiple other scenes they clearly state they would kill someone, can you honestly defend the theory that they would never kill someone?  
&gt;  
&gt;Of course not.  


Here is the thing, I am not saying Danny would never kill someone, hell she smothered her own husband, she burned hundred of soldiers to death, no killing isn't my issue, good character like Jon have killed people, and it was much more hands on, but does that mean I can picture him ordering his men to sack and burn villages, cutting the throats of the smallfolk or turning them to ash on a Dragon? Hell no, and hey you know what, it would make more sense for Jon to do this than Danny because Jon actually has killed a kid with his own hands.

&amp;#x200B;

&gt;It's not that complex... she's like a tea kettle. Over time the pressure builds and builds until that pressure literally reaches a boiling point. We know she has this Fire and Blood persona bubbling up underneath, Season 8 completely implodes her entire world, her psyche is shot and that Fire and Blood persona is no longer 'contained', and she reaches this emotional climax where that Fire and Blood persona hits a violent boiling point.  


You do know that by comparisons achieving boiling water takes longer then Danny falling into madness. At least then I can see the still water, then some bubbles forming at the bottom, every once in a while rising to the top until it does finally reach said boiling point and I can finally put the pasta in.   


Now I can agree, she has gone through a lot, I think they portrayed these tragic events poorly and it comes off more that she will kill everyone because Jon wouldn't fuck her rather than the grief of losing her dragon and Misandi, but my argument would be why is Danny so much weaker than everyone else?  


Jon, Sansa, and Arya have arguably gone through just as hard of times if not worse then Danny and are still somewhat mentally sound, the most fucked up being Arya but even she saw what Danny did and smartly said ""I no a killer when I see one."" WOW THANKS ARYA WE NEVER WOULD HAVE FIGURED THAT OUT!!! Shit getting of topic again.  


But if that doesn't work for you since they are different characters then lets just look at the shit that Danny when through season, her child turned into a stillborn and her husband a vegetable by a women who she tried to save, her kindness and trust resulting in losing two things very important to her. Dare I say that scene has far more justification for her to go mad but she keeps to her more kind-hearted nature and goes on her mission to free the slaves. 

&gt;Sure, I think the show would have benefitted from more episodes to help with some pacing issues, absolutely.. but there's enough 'dots' to connect to see the picture... even if the picture isn't as detailed as it probably could have been.  


Idk about that, with how much of a mess season 5-7 were, I feel like the dots you're saying are there to connect are just 6 points that make you draw a pointy mountain and the book tells you it's a castle. 

&gt;\&gt; for it saved many of the innocents in kingslanding, otherwise why do it?  
&gt;  
&gt;Wait... are you serious?  
&gt;  
&gt;How about to save his father? To save Lannister forces? To save himself? TO help the Lannisters gain power? Because he fucking hates Aerys and what he did to people both behind closed doors and in public?  
&gt;  
&gt;If you honestly believe the only benefit for him to kill the Mad King was solely to help the commoners, you desperately need to revisit the actual story, because  ALL THE REASONS make sense for why Jaime did what he did... not just the single one you've cherry-picked and pretend is some sole reason.  
&gt;  
&gt;I mean, he literally mentions 'father' first in the bath scene question he proposes to Brienne... clearly there is more than a single reason.  
&gt;  
&gt;Again, you're cherry-picking here and pretending like nothing else exists surrounding the issue... bad faith.  


I will admit that those reasons were part of it, yet the key component that can hold up to scrutiny is his want to save the people. For example, he never had a great relationship with his father and it only got worse when he joined the KG.  
Saving the Lannister forces would coincide with saving the people, after all if he dose not care about the small folk why would he care about his fathers soldiers? Not to mention he actually fights against them to defend the red keep which would likely be to defend what smallfolk were able to retreat into the castle. And of course he hated Aerys we don't often kill people we like, unless your Danny, or Jon, or Tyrion, oh shit Jamie killed his cousin (I got my issues with that scene as well) so maybe he didn't hate Aryes.   


And as far as saving himself there were plenty of moments he could have just gotten away without risking his life, even in a way so that his ""honor"" would be intact much like Baristan. Running away and coming back after saying he fought hard and barely survived the wildfire eruption.   
Protecting the smallfolk is what holds up best under scrutiny when you look to his actions even after the events before we see much development with him, stepping in to save Brienne from getting raped, jumping into a bear pit to save her, armoring her and arming her to go find and save Sansa.","season 8"
"75","It’s a good point and generally I would agree. But I also think there’s something to be said about ruminating on things and spinning wild theories over the course of years. Season 8 in particular had a 2 year gap. People went wild. I think it’s the opposite extreme of binge watching. Some of the theories I heard sounded so insane to me even at the time. I kept warning people to lower their expectations.","season 8"
"76","Season 8 is a lot more palatable to binge watchers. In my experience, they can still see the flaws in it, but they look at it a lot more objectively and it doesn’t ruin the show for them. The years of anticipation worked against the show and I think all the hype and expectation building (a lot of it self inflicted by the fans themselves) set the bar unacheivably high. 

The final season for sure failed to meet its full potential 100%….but I will die on the hill that the expectations from people watching it live were unreasonably high.","season 8"
"77","&gt;She actually only said once there would be no civilian casualties - in 702 - and only because Tyrion argued for it.

That's not what she said and that's not what Tyrion argued for. The writers needed Dany not to use her dragons so that they could justify Cersei staying alive. They accomplished that by having Tyrion suggest that any attack on Kings Landing would end in Dany mistakenly killing tens of thousands of civilians and being the ""queen of the ashes"". Tyrion jumping to that conclusion made no sense.

That's not even getting the fact that Tyrion's blockade idea would have killed more civilians than attacking the city outright.

&gt;Seems weird to fixate on that and just ignore the times she talked about how she would destroy cities or the very clear subtext throughout Season 7 and 8 that she wanted to just smash the city and was being held back by her advisors.

That ""subtext"" was the writers using Tyrion, Varys, and Jon  to gaslight the audience by putting words in Dany's mouth. What they were doing is very obvious if you go back and watch those scenes.

&gt;YARA: If you want the Iron Throne, take it. We have an army, a fleet, and three dragons. We should hit King's Landing now. Hard. With everything we have. The city will fall within a day.  
&gt;  
&gt;TYRION: If we turn the dragons loose, tens of thousands will die in the firestorms.

No one mentioned turning the dragons loose. What is Tyrion even talking about when he mentions ""fire storms""? That's not a thing. The writers were just desperate to come up with a way to explain Dany not using her best weapons.

The writers have Tyrion and Jon pull the same BS when Dany suggests burning the Red Keep.

&gt;DAENERYS: I have three large dragons. I'm going to fly them to the Red Keep.  
&gt;  
&gt;TYRION: We've discussed this.

Tyrion was lying here. What they had talked about was Dany attacking Kings Landing. They never talked about her burning the Red Keep. They had Tyrion lie like this so that the audience would connect Dany's new plan with what Tyrion said about her being the queen of ashes in episode 2.

Dany then asks Jon what he thinks of the idea. He responds with:

&gt;JON: ..But if you use them to melt castles and burn cities, you're not different. You're just more of the same.

At no point did Dany or anyone else mention burning cities. Dany specifically asked what Jon thought about her burning the Red Keep.

The leaked outline for that scene shows that Tyrion and Jon were supposed to have an issue with Dany using her dragons on anyone. [Including enemy soldiers.](https://imgur.com/2dacXf2)

The gaslighting got painfully obvious in episode 6 of season 7. Tyrion had spent the entire season freaking out whenever Dany or anyone else brought up using the dragons. The writers seemingly forgot that and had him say this nonsense:

&gt;TYRION: Oh first she'd torture you in some horrible way, then she'd murder you. Nobody trusts my sister less than I do, believe me. But if we go to the capital, we'll go with two armies, we'll go with three dragons, and anyone touches you, King's Landing burns down to the foundation stone.

Tyrion flip flopping like this was already bad enough. It's gets worse.

&gt;DAENERYS: And right now she's thinking of how to set a trap.  
&gt;  
&gt;TYRION: Of course she is. And she's wondering what trap you're laying for her.  
&gt;  
&gt;DAENERYS: Are we? Laying any traps?  
&gt;  
&gt;TYRION: If we want to create a new and better world, I'm not sure deceit and mass murder is the best way to start.

Why is Tyrion talking as if Dany was the one who brought up mass murder? He was the one that had just said that they would burn all of Kings Landing in response to his sister making an attempt on Dany's life.

The writers continued doing this manipulative nonsense in season 8.

&gt;DAENERYS: Cersei will make sure they don't believe it. We will hit her hard. We will rip her out root and stem.  
&gt;  
&gt;TYRION: The objective here is to remove Cersei without destroying King's Landing.

Dany hadn't said anything about destroying Kings Landing.

&gt;GREY WORM: We will storm the city, my queen. We will kill your enemies. All of them.

VARYS: Cersei needs to be destroyed, but if we attack King's Landing with Drogon and the Unsullied and the Dothraki, tens of thousands of innocents will die. That is why Cersei is bringing them into the Red Keep. These are the people you came here to protect. I beg you, Your Grace. Do not destroy the city you came to save. Do not become what you have always struggled to defeat.

The idea Vary puts forward here is nonsense. The writers didn't even attempt to validate his alarmism. Dany ends up getting the city to surrender without causing any serious collateral damage. The idea that Dany was being stopped from destroy Kings Landing was always nonsense.","season 8"
"78","Everything. Season 8 was better than 6, 7 not so much.","season 8"
"79","I'd stop before season 8. Just imagine GRRM died and they couldn't finish it without him. 

Don't ruin it for yourself and heed the advice.","season 8"
"80","I’ll see you in a week after season 8","season 8"
"81","Those people are the people that didn’t get the point of the show to begin with. 

The people who are genuinely mad at how it ended are the people that felt it was too rushed and that 6 slightly longer episodes didn’t do an entire season (at least) worth of storytelling any justice. 

The series always gave the viewer room to breathe in between the big moments. Nothing ever felt like it was moving too quickly, and the slower paced moments always had meaning. They led to something. They gave you anticipation and allowed the viewer to become invested in the story. 

Season 8 abandoned nearly everything that made the show what it was originally. Sure, it had a ton of great moments and the acting was superb as usual but the show deserved more than what we got. Both seasons 7 and 8 deserved 10 episodes each. Then it would have likely felt like it didn’t sprint to the end.","season 8"
"82","If season 8 was as an amazing finale as it should have been season 7's issues would have largely been ignored, it's when the core of the show falls that causes all the other little holes to combine into big ones","season 8"
"83","Fair points, and good reference, touché. Benioff's phrasing in that interview is definitely the issue on that point.

However, aside from that stupid interview, the main issue with scenes like this is now made plain to me again by watching it - that a lot of this dialogue is quite out of character, bearing attitudes that are not adequately set up, breaking the immersion with how hard the writers were trying to warp the characters around what they wanted to do without putting in the hard yards to make it make sense. Effectively a shift from character-driven storytelling of earlier seasons to plot-driven characters.

Just reminds me that season 8 was quality end points shrouded in a rushed array of set ups, really unfortunate how close it was to not being stilted.","season 8"
"84","I also thought season 8 was good. Rushed for sure. But still good. The Long Night was epic. The Bells was another amazing episode. Finale was meh but overall a good season.","season 8"
"85","Season 7 wasn’t totally bad. Yes a lot was rushed. But I was so hyped and couldn’t wait for season 8 to come. Season 7 is a top season in my mind.","season 8"
