"","body","season"
"1","I really liked Mance's speech to Jon about refusing to kneel. And Stannis offering Jon the chance to become Jon Stark and become Lord of Winterfell.

I fantasize about an open world GoT game where Jon kneels as the game starts. You play as Jon Stark and prevent season 8 from happening","season 8"
"2","I went back and watched the entire series again. And now. Don’t hate me. Because season 8 was terrible from writing and the story and the dialogue but after binging it all vs watching it as it came out…

I actually liked the big story beets from 50000 foot view. I get what the show runners wanted to do and convey the execution was terrible. Like I legit said at the end when Danny burned the city “you know what fuck it. She deserves this. Fuck Westeros.”  And it’s true. The entire continent is just filled with trash and bad people and Danny got fucked by everyone she let into her life. I understood her motives and understood why she had to be stopped but the writing and pacing was terrible. 

also looking back. You know what? Ned and Robb stark were both dumb as hell and honestly the entire stark family is the personification of failing up.","season 8"
"3","Arya is eerily unhinged. Not sure why the show glorified that scene. They hype up revenge and mass murder then turned around in season 8 and had the Hound preach to the mass murderer that revenge = bad and had Arya be the sympathetic POV character for Dany torching a city.","season 8"
"4","I'm assuming you are talking about the season 8 part. I assume semi-autonomy would be the best compromise between them and the Targaryens for peace and so that the Targaryens won't invade. They would basically be a vassal state, and that we don't have enough time to explore more content.","season 8"
"5","I know there's a lot of varying theories in the nature vs. nurture debate. The problem is that the one who nurtured her from birth was Viserys, who I think we can all agree was not a good role model. When she is first shown she is quite timid and passive, but the Targaryen madness starts to leak trough early on. She lets her brother die a horrible death (granted, he kind of deserved it, but she didn't object to the cruel method). When Khal Drogo promises to raid and plunder and rape the Seven Kingdoms, she does not object, even being a victim herself. She burns Mirri Maz Duur, and enjoys it. Outside Qarth she promises she will return with fire and blood. She lets the dragons kill the undying (again, they were not good people, but still), and locks Xaro Zhoan Daxos and Doreah in that vault as soon as she realises their betrayal. At Astapor she burns the slavers (they were bad people, right?), and frees the unsullied. Granted, at Yunkai she's a bit more diplomatic, but the cruelty returns at Mereen when she crucifies those masters (slavery is horrible, surely they deserved it). Then when she is captured by the Dothraki, she burns the Khals (part of it was probably self defence, and she most likely had good reason to do so). Afterwards she takes command of the Khalasar, knowing full well that the Dothraki are a raiding and plundering people. At Mereen she burns some more slavers with the dragons, but that is understandable, as that is a battle.

Then she arrives at Westeros, and she has to face characters that we know. Her experiences have shown her that killing those she deems as enemies works out, and she believes that she is some sort of savior. So she doesn't really have any qualms about burning the westerosi. She kills the Tarlys this way, and has to be advised against just going to King's Landing with her dragons. Pretty much every time she encounters a problem throughout the show, her initial response is to kill and burn. Her advisors always stop her in time, but at the time of season 8, her trust in them is growing thin. Jorah and Barristan have died, and so did Missandei (whose final words were a callout for Daenerys to burn her enemies). Two of her children die in a short span of time, making her more unstable. Varys betrays her, and Tyrions openly doubts her more and more. Jon is loyal, but she is unable to trust him after she learns of his lineage (even though he is adamant he does not want to push his claims). That leaves Grey Worm, and he becomes hell bent on revenge after Missandei is killed.

So no, Daenerys would never be a good ruler. As a matter of fact, she'd be among the worst rulers of the Seven Kingdoms, right next to Maegor the Cruel, Aegon the Unworthy, Joffrey Baratheon/Lannister and her own father, the Mad King. Her reign would be one of fire and blood, and the innocent and guilty would suffer alike.","season 8"
"6","She looks like season 8…","season 8"
"7","The problem goes much deeper. They couldn't adapt book 4 completely, because it's for the most part unrelated to the main story. Feast for Crows feels like a spinoff within the series. You can see this in the narrative structure: https://en.wikipedia.org/wiki/A_Song_of_Ice_and_Fire#Narrative_structure

It's essentially a book about Cersei, Jamie, Brienne, Sam(!) and the Greyjoys. If you turn this into a full season, you ratings will take a dive even worse than during season 8. It was correct to merge it with Dance of Dragons. Last but not least, GRRM doesn't need time to finish the series, he needs motivation.","season 8"
"8","Season 1 Tyrion had the hairstyle of a 70s porn star. Season 8 is definitely an improvement.","season 8"
"9","&gt;Obviously she had a traumatic childhood, but she does become utterly obsessed with revenge and murder, to the point she ends up baking an entire house into a pie. 

Couple things: first off she did not ""bake an entire house into a pie"".. it was like a person or two. Yes, still super bizarre, no doubt, but that brings me to the second thing. 

The ""Frey Pie"" is an easter egg from the books that they have shoehorned into Arya's character. She doesn't do it in the books, but because the Northern politics are less prevalent in the show, they just gave her that action because she's a named character. 

Just saying it's not something that they wrote into the script because they believed her character was building up to this point... merely took what another family did and slapped it on her character.   

&gt;\&gt; Yet people cheer for her big time and very rarely point out how completly psychopatic her character arc is.

I think there's a huge gap between characters like Dany and Arya in regards to 'madness' or 'psychopathic tendencies' though. Dany, multiple times, has shown a capacity for genocide multiple times even before Season 8, literally claiming she would kill thousands of innocent people simply because she's pissed, whereas Arya just refused to kill a single innocent person and was nearly killed for such a refusal. 

That's two clearly different states of mind at play here. Sure, Arya kills a lot of people, but because of that Stark code of honor mixed with Yorren's list, she comes off as a much more stable and justice-focussed character.

Like, we see her spare the Frey women and children because she knows they weren't involved with the Red Wedding... it's not like she's just out for everyone's blood at times like Dany was. 

I think it's fine to raise an eyebrow and keep a close eye on Arya, sure, but labeling her a psycho simply because she seeks justice for the murder of her mother/brother/countrymen seems a bit of a stretch.","season 8"
"10","They could do that if the final season gets backed up as an alternate reality, but then they can fix all the plot holes. Would you rather accept the damage of the final season ruining the entire GoT universe, or blip it for 5 minutes as season 9 guised as a vision and attempt to undo the damage or redo what you felt season 8 should have been?","season 8"
"11","From my perspective is leaking something of a season 8 of a series will always be a spoiler","season 8"
"12","Season 7 writing was just as nonsensical as season 8 lol. The same with 5 and 6, but especially 7. Don't know why people pretend like the show just went to shit in season 8, maybe denial.","season 8"
"13","Yikes my b I’ll mark it— debated the  settled on it being common knowledge who’s in season 8 generally (cause marketing and finale hype etc), but rather safe than have it possibly spoil someone :O","season 8"
"14","I second this. I watched shortly before season 8 came out and managed to not get spoiled until I found this sub while I was in like season 4 or 5","season 8"
"15","I believe they were saving a lot of the secrets for Blood Moon.

And then with the response to season 8, cancelled Blood Moon.

What a shame.","season 8"
"16","Season 8 episode 6","season 8"
"17","Exactly. It’s a huge reason for Dany’s massacre—his claim to the throne will get out, and people will prefer him, so she has to crush them into submission. She even says earlier in the ep (or in another I can’t remember) “fear it is”, meaning she is choosing to rule by fear. Yeah that whole thing is not particularly well executed but Jon’s identity is definitely relevant, of all the things to criticise season 8 for imo that’s not one of them.","season 8"
"18","When did the season 8 finale air?","season 8"
"19","Your explanation of what happens in season 8 sound interesting in a bubble. The execution was absolutely garbage though. So that's where we stand.","season 8"
"20","Same, I also just finished the show after 2 months. The fist 2 episodes of season 8 were boring, in the 3rd episode I thought the battle was good but ending was bad. How tf did arya sneak past the white walkers and wights to stab the night king? Also dany burning all the people in kings landing after the bell was rung made me mad. The last season could've been a million times better","season 8"
"21","I'd watch this again unlike season 8.","season 8"
"22","I’m sorry man but there’s basically countless dissertations worth of information available to you if you are genuinely interested in why the final season was such a train wreck. So I don’t feel compelled to write yet another one myself. 

It’s fine if you enjoyed it. I have some less than stellar shows &amp; movies that I get a kick out of. However in the case of GoT season 8, it’s the contrast to the literal historic quality of the first 5 or 6 seasons that should make the decline to any discerning mind rather obvious….. 

And knowing that HBO &amp; GRRM himself felt the show needed multiple more seasons (minimum 10 seasons according to GRRM IIRC) to wrap things up, but D&amp;D decided to rush through it so they could continue advancing their careers with franchises like Star Wars… What is there even to debate? D&amp;D clearly rushed to wrap the series up to suit their career ambitions and the quality suffered. It’s not rocket science…..","season 8"
"23","&gt;She had everything she wanted and just opted for senseless cruelty.

If you honestly believe this then you need to revisit Season 8, as the last season clearly implodes Dany's entire world around her, leading her to a point where her psyche seems to be broken, as she is clearly a shell of her former self... she certainly did not have 'everything she wanted' as you mistakenly believe.

Her support structure crumbles through emotional deaths and perhaps even more emotional betrayals.

Her hopes, dreams, and beliefs are all shattered through Jon's heritage reveal (she's not *The Chosen One* as she believed) and the realization that Westeros doesn't love her.

Practically all remaining relationships have turned to ash in her mouth, as Jon doesn't want to pursue a romantic relationship and everyone else has basically died because of her actions or has betrayed her in some sense.

This so clearly is not *everything she wanted.*

What she wanted was to be The Chosen One, the Rightful Heir, with the people of Westeros adoring her, not unlike her time in Slaver's Bay. But that so clearly was not something she would be able to obtain once Jon's heritage was revealed/secret was out... hence she chooses Fear instead.

I agree a couple more episodes would have helped some pacing issues with every single arc, but I think it is fairly clear that this situation is so far removed from what she has built up in her head... this is not what she wanted, or rather the situation surrounding winning the Throne is so far from ideal that she states ""Let it be Fear.""

&gt;\&gt; This kind of total lunacy is the type of thing that would rightfully take years longer to build up to.

Which they ~~absolutely~~ *for the most* part did.

They have laid a fair amount of groundwork for this path across Dany's arc.

They show she has this Fire and Blood persona all the time. She literally screams that she will take what she wants with Fire and Blood. She cooly watches as people are inhumanely executed. She kills people who are innocent when she's pissed.  Her advisors, constantly, tell her to chill out/tone it down.

They have shown, *multiple times*, a very clear willingness/capacity to raze entire cities because she believes the ends justify the means.

And most of this happens during her time in Essos, where she is clearly trying to do good. But her doing good doesn't magically erase that Fire and Blood persona.

And her time in Westeros simply tears down the psyche of this young adult with a family history of mental issues and who herself had an incredibly fucked-up upbringing.

This is a person who has threatened to raze entire cities multiple times previously... and now her world is crumbling in upon itself.

If someone who threatened to shoot up a school multiple times, then fell on incredibly hard times (loses support relationships, lifelong goals/dreams shattered, promising relationships gone, etc), would you be shocked to learn that person shot up a school?

Not really, right? Because the pre-cursors, like literally threatening this very act multiple times previously, are there... the groundwork for such an act is there.

Just like it was with Dany.

Just have to be able to take off the rose-colored glasses in order to see the red flags for what they are.","season 8"
"24","So, does it just cover season 8 then? 

;)","season 8"
"25","I'm willing to overlook bad logic for a cool moment once in a while. Season 8 just overloaded me and it's hard to overlook THAT much shit. Just my opinion.","season 8"
"26","&gt;Yes he can go back on honour for his love but the writing needs to be in a way that makes it a big deal. It felt like I’m going back to Cersi and all I cared about was poor Brienne.

Sure, like all of Season 8, it could have been written better, absolutely. I certainly wouldn't claim it was written/executed masterfully... merely that this arc makes absolute sense for his character. There is nothing surprising/shocking/out of character for this person to return to the person he has a literal life-long bond with. Sleeping with another woman one time doesn't magically undo a 40+ year bond, as some people seem to think.

That said, I would actually argue that him basically sacrificing his life/future just to be with Cersei one last time is arguably a culmination of his ""honor"" arc, considering it may be the most honorable thing he's done on-screen... sacrificing his future just to be with his sister/lover one last time in her hour of need.

I mean, if the roles were reversed and he left Cersei to be with Brienne one last time, everyone would cheer it and love it and talk about ""honor"", but because the names are reversed and the viewer is meant to be disappointed, suddenly the act itself is overlooked as being 'honorable.'

&gt;\&gt; So Danerys arc and development she kills evil people, so slavers ect. But the slavers she killed hanged corpses on crosses so quite evil. The sons of harpy killed her friends army and devastated the city. But no there’s innocent people their so I’m not going to kill everyone. What’s even better here is it didn’t even come up as an option.

This is a character who has, very clearly, shown a willingness/capacity to commit widespread genocide over entire cities, innocents and all, multiple times. That's fact.

She absolutely has inhumanely executed innocent people, multiple times. That's fact.

She, herself, stated she was going to raze Astapor and Yunkai before Tyrion had to stop her from doing so. That's fact.

Her world completely imploded across Season 8 (support structure crumbled, hopes and dreams shattered, relationships turned to ash in her mouth) and she seemingly reached a boiling point where that Fire and Blood persona was finally fulfilling the very threat she's meaningfully made previous times before.

And to be clear, I'm not dismissing all the good she did in Seasons 3, 4 and 5... merely pointing out that she is a character with two clearly distinct and warring personas... *conflict within the human heart* and all. Yes, she has a kind-hearted persona, no doubt, but she so clearly has this Fire and Blood persona that threatens to erupt multiple times long before Season 8... and as her hopes and dreams are soured that Fire and Blood persona threatens to be unleashed in full force... which it eventually was.

It's there. On-screen. The groundwork absolutely was laid for this potential arc. If you honestly don't see it, I would recommend revisiting the show with fresh eyes and an unbiased stance, as plenty of people have pointed out these very issues in regards to Dany for years... long before Season 8 ever aired.

Sure, a couple more episodes would have helped with pacing, no doubt, but her arc constitutes a huge path of red flags... even across Essos when she was doing her 'best work.' 

*Fire and Blood. The Last Dragon. Dracarys.*","season 8"
"27","Varys died in season 5 cause whoever that was in season 8 was a faceless man pretending to be Varys. The rest earned their deaths lol. Dany never killed innocent children. She literally locked up two of her dragons cause of one innocent child being roasted.","season 8"
"28","We don't talk about season 8.","season 8"
"29","If you’re going to complain about it at least be educated on what you’re saying. There is no wildfire at Winterfell. Sure there are quibbles to be had with *some* of the elements of season 8 but I swear people are just trying to find things to nitpick because it didn’t go the way they wanted it to.","season 8"
"30","I like season 8. If I didn't, I wouldn't have spent 3 years and almost £3k replicating a costume from it ;)","season 8"
"31","&gt;I just have to believe Arya was smarter than how they wrote her.

And then you watched season 8.","season 8"
"32","Dany and Jamie scenes.

Some viewers sure love to whinge about how those character arcs ended, but seemingly tend to forget/are unaware that their actions/choices in the end absolutely have had the groundwork laid for them across their entire arc leading up to Season 8.

Some people, over time, seemingly placed these two characters on some pedestal where only some grand animated Disney resolution would suffice, but, on-screen, these characters are portrayed as gray characters capable of both great and terrible acts, often based on both great and terrible choices.

Dany so often shows this Fire and Blood persona throughout her arc (as her advisors constantly tell her to tone it down) and her relationship with *power* becomes an increasingly suspect one, as when she doesn't have it she curses those who abuse it, but then as she gains power seemingly abuses it herself. Her whole arc is a series of hypocritical words/acts mixed with this fiery persona building up to a boiling point as her world comes crashing down upon her during her time in Westeros.

Also, people love to claim that her ""entire story"" revolved around helping the innocent, but that wasn't really the case, as it was a temporary goal of hers from midway in Season 3 (she literally went to Slaver's Bay in order to specifically purchase fighting slaves) to the end of Season 5 (when she rides off on Drogon.) That's it... aside from one single episode in Season 6, so maybe 25 episodes out of 70+. It's a nice arc, and certainly helps show off one side to her character (that many fans latched onto) but hardly an ""entire story"" as tends to get parroted. She spends Seasons 1, 2, half of 3, 7 and 8 trying to win the Iron Throne for herself... clearly a majority of her on-screen time.

As for Jaime, he so clearly has this soft spot for Cersei and literal life-long bond with her that I'm surprised so many people were gobsmacked by his decision. He literally spends 7+ seasons doing anything/everything for her while not giving two fucks about anyone not named Lannister (or Brienne), but people seemingly are surprised that he went back to her simply because he slept with someone else once over 40+ years? And are surprised that he stated that he didn't care about people, despite it being pretty obvious for 7+ seasons that he didn't care about people. I mean, there are specific scenes when he is with Cersei when he literally states that he doesn't care about anyone else, but somehow people think their own personal head canon/interpretation of the bath scene magically supercedes what he literally states on-screen about the commonfolk.

I honestly believe if you review these two characters with an open mind and fresh eyes, that Season 8 is not ""as bad"" as many people claim. Sure, the last seasons will always be a bit rough, but I think having a unbiased understanding of these two characters will help anyone understand how these two arcs end by shedding a neutral light on how these characters got to this point.","season 8"
"33","They didnt cut it out. Dorne was part of the story since season 2. Season 7 was good. Season 8 was a masterpiece, not flawless but damn ambitious. Propably too much for its own good.","season 8"
"34","Yeah ok, all opinions are opinions, but just cause you’re opinion of a flaming dumpster is that it is a warm fire doesn’t make you any more credible as an authority for “good fires “, and season 8 was*definitely* a dumpster fire. It had established, lovable casting, sets and budgets, but i still can’t respect being blinded by all that after reading the novels.","season 8"
"35","Well, you asked in wich ways season 8 was better and i answered. Ending for jon and dany is great. 
For both of them.","season 8"
"36","Did you like Season 7? If yes, you will like Season 8 as well, imo it is much better than 7.","season 8"
"37","Did you like Season 7? If yes, you will like Season 8 as well, imo it is much better than 7.","season 8"
"38","Watching season 8 actually makes the show as a whole worse... It doesn't really do a good job on any of the characters. There are other characters it does dirtier than the two you mention, but it's not good for any of the characters. 

I haven't touched GoT since watching the last episode... not much reason to rewatch when the show got ruined by the ending.","season 8"
"39","I understand where you are coming from. To be honest though, I don’t think season 8 totally ruined the series. There are things that I do not like, but what happens in the end kind of makes sense. It all ties together. I still think that GOT is one of the greatest shows that I have ever watched! A lot of shows have bad endings such as That 70’s Show, Lost, HIMYM, but I did not let it ruin the greatness of the shows itself. I hope that this helps :)","season 8"
"40","Listen carefully  to the second episode when Cat is laying out her suspicions. That scene foreshadows an episode in season 8.","season 8"
"41","Casual viewers seemed to love it. Actually the casual viewers really seed to love seasons 5-8, prob until episode 5 if season 8.","season 8"
"42","There is no season 8 in Ba Sing Se","season 8"
"43","As someone who started watching GOT this year and just recently finished the series. PLS PLS PLS DO NOT SKIP SEASON 8. It definitely seems rushed, but certain things really do make sense in the end. Personally, I didn’t even think that it ended that bad and am looking forward to watching the prequel House of Dragons. 

I am also a believer that even if the ending season is bad in a series I have to watch it such as That 70s Show, Lost, TVD etc. It is always good to find out how the writers want to end the show. As well as that, if I rewatch these shows I usually just skip the last season, but I feel that every series is worth at least one full watch. I don’t think you’d regret watching the last season. Enjoy GOT if you end up watching it! I highly recommend:)","season 8"
"44","This is the most I’ve seen a cast member make fun of Season 8 or poke fun at Dumb and Dumber","season 8"
"45","Season 8? there was no season 8. &lt;jedi hand movement&gt;","season 8"
"46","I mean, in comparison to season 8, 7 wasn't all that bad, but compared to the other seasons, especially 1-4, 7 was garbage","season 8"
"47","I meant season 8!! I watched 7. It was alright
..hard too see in some episodes but it was okay.","season 8"
"48","Yeah it was really bad and then season 8 managed to be even worse","season 8"
"49","This is why Ive chosen to never watch season 7 and remain in blissful ignorance instead. I know S7 was bad, but will never have to know EXACTLY how bad.

Edit: I meant season 8 lmao.","season 8"
"50","Yeah think of it like star wars. The terrible recent sequels don’t ruin the original movies.

For me it was mainly season 8 that was bad, ending every storyline the show set up way to quickly and with big writing problems. Though in the long term, I’m more angry that the show ended so soon, rather than that the last season was bad.","season 8"
